<?xml version="1.0" encoding="us-ascii"?>
<!DOCTYPE properties SYSTEM "../dtd/properties.dtd">
<!--
    Generated by Zeligsoft Component Enabler 2.0.2 (Build: 200510131317)
    http://www.zeligsoft.com
-->
<properties>
    <description />
    <simple id="DCE:cea26b54-9d86-4b68-a761-14186efa9415" type="ushort" name="DecimateBy" mode="readwrite">
        <value>1</value>
        <kind kindtype="configure" />
    </simple>
    <simplesequence id="DCE:134e5dd8-c773-47af-a557-2837076358c4" type="float" name="filter" mode="readwrite">
        <values>
            <value>1</value>
        </values>
        <kind kindtype="configure" />
    </simplesequence>
</properties>
