<?xml version="1.0" encoding="UTF-8"?>
<!DOCTYPE properties SYSTEM "../dtd/properties.dtd">
<!--Created with OSSIE WaveDev Beta Version 0.6.0b-->
<!--Powered by Python-->
<properties>
    <simple type="float" id="DCE:aaf97fa0-d184-4d88-9954-3a1334c73d6d" name="energy_lo" mode="readwrite">
        <description>low energy threshold</description> 
        <value>4000</value> 
        <kind kindtype="configure"/>
    </simple>
    <simple type="float" id="DCE:346e17c9-6678-483a-bffb-1909c64bddc0" name="energy_hi" mode="readwrite">
        <description>high energy threshold</description> 
        <value>4000</value> 
        <kind kindtype="configure"/>
    </simple>
    <simple type="float" id="DCE:4608b943-4fe2-49df-91fb-afa287b609d4" name="k_attack" mode="readwrite">
        <description>attack time constant</description> 
        <value>0.002</value> 
        <kind kindtype="configure"/>
    </simple>
    <simple type="float" id="DCE:491ec3de-ed45-48af-a6fc-ca2d6465e136" name="k_release" mode="readwrite">
        <description>release time constant</description> 
        <value>0.0005</value> 
        <kind kindtype="configure"/>
    </simple>
    <simple type="float" id="DCE:312f63fe-709a-4217-933b-c584c8d6a9bb" name="g_min" mode="readwrite">
        <description>minimum gain value</description> 
        <value>1</value> 
        <kind kindtype="configure"/>
    </simple>
    <simple type="float" id="DCE:8357ee0d-2417-46d9-8475-2e5778d797e4" name="g_max" mode="readwrite">
        <description>maximum gain value</description> 
        <value>100.0</value> 
        <kind kindtype="configure"/>
    </simple>
    <simple type="float" id="DCE:b9b72ec8-d0bd-4060-b356-dcc6b0809e65" name="rssi_pass" mode="readwrite">
        <description>Received signal strength level above which data will be passed</description> 
        <value>1000</value>
        <kind kindtype="configure"/>
    </simple>
</properties>
